{
  "schema_version": 2,
  "task_id": "11111111-1111-4111-8111-111111111111",
  "session_id": "session-1",
  "run_id": "run-1",
  "workspace_root": "/workspace",
  "policy_epoch": 7,
  "task_objective_hash": "sha256:0101010101010101010101010101010101010101010101010101010101010101",
  "task_policy_hash": "sha256:0202020202020202020202020202020202020202020202020202020202020202",
  "tool_proposal_hash": "sha256:0303030303030303030303030303030303030303030303030303030303030303",
  "execution_request_hash": "sha256:0404040404040404040404040404040404040404040404040404040404040404",
  "intent_evaluation_hash": "sha256:0808080808080808080808080808080808080808080808080808080808080808",
  "authorization_decision_hash": "sha256:0505050505050505050505050505050505050505050505050505050505050505",
  "execution_authorization_hash": "sha256:0606060606060606060606060606060606060606060606060606060606060606",
  "execution_record_hash": "sha256:0707070707070707070707070707070707070707070707070707070707070707",
  "started_at": 1000,
  "completed_at": 1100
}
